Title,Link
The Beginning Of The End For The Roman Empire - Britain's Secret Homes,https://www.youtube.com//watch?v=CzsV18CZ980
The Roman Invasion of Britain,https://www.youtube.com//watch?v=zBOP9Xwveec
The Roman Empire's Invasion Was Similar to D-Day,https://www.youtube.com//watch?v=6MbZ3FpgkPo
Holy Roman Empire Newspaper Headline,https://www.youtube.com//watch?v=UEvJ8lNPsds
BBC Schools: Zig Zag: Roman Britain - Invasion,https://www.youtube.com//watch?v=Nm5k98geGAk
Roman Britain Video 1,https://www.youtube.com//watch?v=xPp3AIxD5pg
Roman Soldiers in Ireland? - The Bearded Historian,https://www.youtube.com//watch?v=w5yZtP1sBiE
Roman Britain - Edgar Cayce's Reincarnational History of Britain,https://www.youtube.com//watch?v=xcnCry3C3jg
Britain's Forgotten Pirate Emperor - Coins of the Romans: Carausius,https://www.youtube.com//watch?v=-g96VdDmcaI
influence of roman occupation of britain essay,https://www.youtube.com//watch?v=cdnvQjLC2kA
Migration and ethnicity in late roman Britain - 30 marzo 2016,https://www.youtube.com//watch?v=fJyewhttILk
Fields of Mars #3 | Remember the Gods | TW Attila Roman Britain NLP,https://www.youtube.com//watch?v=SoIinxVYCHQ
Fields of Mars #5 | Massacre At Tuesis | TW Attila Roman Britain NLP,https://www.youtube.com//watch?v=R1PbkVIoVbk
Contrarii Moribus: The Invasion of Roman Britain,https://www.youtube.com//watch?v=9mpxF0pUvLE
History Re-Written: Ralph Ellis & Michael Tsarion on Truth Warrior,https://www.youtube.com//watch?v=haZ6Go5s_LE
The Roman occupation of Britain 43 - 410 and its legacy,https://www.youtube.com//watch?v=BlOYmOhDENo
Total War: ATTILA Roman Britain Ep. 1,https://www.youtube.com//watch?v=9nlJcI9zL74
PENDRAGON: The Fall of Roman Britain,https://www.youtube.com//watch?v=W-yIpPVQl2Y
THE SCOURGE OF IRELAND! Total War: Attila - Age of Charlemagne - Holy Roman Empire Campaign #56,https://www.youtube.com//watch?v=P_ZzS_r6nVU
Fields of Mars #7 | Winter Revenge | TW Attila Roman Britain NLP,https://www.youtube.com//watch?v=pUeH5EvTv44
"""Boudicca, The Warrior Queen"" - Decisive Battles of the Ancient World (10of13)",https://www.youtube.com//watch?v=yuPCTqC1vuU
"Nero, the Roman Emperor (part 1)",https://www.youtube.com//watch?v=z446rURhkiA
Fields of Mars #2 | Beyond The Wall | TW Attila Roman Britain NLP,https://www.youtube.com//watch?v=BT3JmQIJnTE
Dr. Robin Fleming on the Material Investigation of Post-Roman Britain,https://www.youtube.com//watch?v=60maeLKgySY
End of the Roman Empire (Speed Version),https://www.youtube.com//watch?v=TXByBVbNyeE
Total War: Attila - Roman Britain Ep 1,https://www.youtube.com//watch?v=Slff5ZuRxbU
SkyWatchTV News 7/5/16: Bill Salus - Brexit and Bible Prophecy,https://www.youtube.com//watch?v=_cQSvk3BS-c
The Holy Roman Empire Is Here Now,https://www.youtube.com//watch?v=fCyPM1SFQO0
Total War: Attila - Roman Britain Ep 4,https://www.youtube.com//watch?v=QvVpczFQSOM
The Roman Invasion - Lego Animation,https://www.youtube.com//watch?v=Hm7ivkH8s5w
Fields of Mars #4 | Tullus The Shield | TW Attila Roman Britain NLP,https://www.youtube.com//watch?v=efYOnQlMid4
Fields of Mars #8 | The End of a Dream | TW Attila Roman Britain NLP,https://www.youtube.com//watch?v=sPhh-6UWwvY
Fields of Mars #6 | No Such Thing As Peace | TW Attila Roman Britain NLP,https://www.youtube.com//watch?v=TxA4e3Lxz94
Total War: Attila - Roman Britain Ep 3,https://www.youtube.com//watch?v=xSVLf6eHLME
End of Roman rule in Britain,https://www.youtube.com//watch?v=u-sAxOBuCZo
The Real Life Game of Thrones Part 1: Is Great Britain Westeros?,https://www.youtube.com//watch?v=Pj9fn4L4Njk
2◀Ryse: Son of Rome: Invasion of Britannia,https://www.youtube.com//watch?v=26s1WMGhhmU
THE ROMAN EMPIRE THE ICENI REBELLION,https://www.youtube.com//watch?v=PK7XoKRCBM4
Roman Britain,https://www.youtube.com//watch?v=5qtotZ3OsMo
Roman invasion 3,https://www.youtube.com//watch?v=8ieye09ckV0
Roman invasion,https://www.youtube.com//watch?v=XnZFVsZP2IQ
Roman Britain,https://www.youtube.com//watch?v=_5JDtdjPpkc
Roman invasion 4,https://www.youtube.com//watch?v=wbp6L_MugE8
BBC Schools: Zig Zag: Roman Britain - Fighters and Builders,https://www.youtube.com//watch?v=uNam8s2Pt28
31   Ch 16 The Conquest of Britain  43 61 A D   Sect  II  & III   Students ' Roman Empire pt 1   Joh,https://www.youtube.com//watch?v=G-xrNTy7Aws
Loss of Albion (British) Indigenous Sovereignty,https://www.youtube.com//watch?v=g53zR92rYls
The Wall Through The Painted House - Britain's Secret Homes,https://www.youtube.com//watch?v=7p-baOO0IPE
THE ROMAN EMPIRE THE ICENI REBELLION,https://www.youtube.com//watch?v=JmDGp8do5WE
Sven Longshanks: The Hidden History of Christian Britain 8/01/16,https://www.youtube.com//watch?v=o4PgroWGQQg
"Dressing Fairytales: The Costumes of ""Cymbeline""",https://www.youtube.com//watch?v=KiBSIcMuMe4
Mad Munchkin Snackage Episode 15 Asterix in Britain,https://www.youtube.com//watch?v=y_Mm346Ra8Q
HOW THE ROMANS RULED THE WORLD - MARCHING CAMPS - HISTOROFILES MINI 003,https://www.youtube.com//watch?v=7rRnuN6jCYs
The Roman Empire - Episode 7: Letters From The Roman Front (History Documentary),https://www.youtube.com//watch?v=rm9U0gbx_jA
Discover the History of English,https://www.youtube.com//watch?v=aEH2GkuRIHs
Roman invasion 6,https://www.youtube.com//watch?v=jrwurWlvWxk
Exotic Celtic Medieval Music Magic Enchanted Forests Warriors Britain Druids Prophecy Middle Ages HQ,https://www.youtube.com//watch?v=KFGZprxDwSY
What if the Roman Empire Reunited Today?,https://www.youtube.com//watch?v=pbvrncwxzxU
30   Ch 16 The Conquest of Britain  43 61 A D   Sect  I   Students ' Roman Empire pt 1   John Bagnel,https://www.youtube.com//watch?v=JcK4MeexzgQ
Roman invasion 5,https://www.youtube.com//watch?v=lW4kAWOnMpY
Rome The Rise and Fall of an Empire 10of14  Constantine the Great,https://www.youtube.com//watch?v=ukFjpu63dPY
Roman client kingdoms in Britain,https://www.youtube.com//watch?v=nbbTD2Q1bsY
VFTB 322: Bill Salus - Brexit and Bible Prophecy,https://www.youtube.com//watch?v=NFA1qduvTCI
Roman invasion 2,https://www.youtube.com//watch?v=oWYMXiY_tV8
How did Rome conquer Greece ?,https://www.youtube.com//watch?v=tiaVCTNa-7Q
End of Roman rule in Britain,https://www.youtube.com//watch?v=Ur9NlWNaJCk
Sub-Roman Britain,https://www.youtube.com//watch?v=IGb8IuZqAhM
"ROMAN EMPIRE 1/30 scale,play set no 1... strategosathena on line shop we present..",https://www.youtube.com//watch?v=o92uRAVa9qE
도미네이션즈 브리튼vs로마제국 투석기시대 창세기전 - Sea bream Nations in Britain catapults vs the Roman Empire era,https://www.youtube.com//watch?v=SXyAOd7Q4q8
The Revolt of Boudica 60/61 AD,https://www.youtube.com//watch?v=qUSqUq7e5QI
Blood in the Arena: The Spectacle of Roman Power Audiobook,https://www.youtube.com//watch?v=NSeCpcXXuN0
ROMAN ROADS SECRET PATHS TO EMPIRE  Full Documentary 2016,https://www.youtube.com//watch?v=Jl6fgFecqS0
KPA 3rd Grade Oral Timeline (Section One),https://www.youtube.com//watch?v=wv0spj8wLrA
"Barbarians Rising: Boudica, Warrior Queen | History",https://www.youtube.com//watch?v=9G01vm9MVa4
Ancient Rome (7of8): Letters from the Roman Front,https://www.youtube.com//watch?v=ihIqjQCJlc0
"Roman Invasion The Slaves, Episode,1,Season 5",https://www.youtube.com//watch?v=tFTrOCAo_Bk
"Roman Invasion The Slaves, Episode,1,Season 3",https://www.youtube.com//watch?v=WNA7DqGcV7Y
Romano-British culture,https://www.youtube.com//watch?v=IYxzadJBrLA
"Roman Invasion The Slaves, Episode,1,Season 4",https://www.youtube.com//watch?v=dNJhhhgnbWM
Great North Museum - Roman monument scans,https://www.youtube.com//watch?v=J5DjzWCzgr0
"The Decline and Fall of the Roman Empire, Volume Iii",https://www.youtube.com//watch?v=h62gfhYjgxA
roman invasion,https://www.youtube.com//watch?v=1apRx2_MmSo
"Roman Invasion The Slaves, Episode,1,Season 6",https://www.youtube.com//watch?v=uDAyWcJmFBI
Catholic Ottomans 6: Africa & Great Britain,https://www.youtube.com//watch?v=jww9x3j6DIs
"Roman Invasion The Slaves, Episode,1,Season 12",https://www.youtube.com//watch?v=8Mq7HCLy4sg
Hoxne Hoard,https://www.youtube.com//watch?v=UXrkRcuX8sQ
Treaty Of Westphalia By Lindsay Sweet,https://www.youtube.com//watch?v=IsE4Q7EDqZE
Huge Fort From Roman Empire Discovered In Lancaster,https://www.youtube.com//watch?v=GYMay6rHmLU
Who Is Julius Caesar?,https://www.youtube.com//watch?v=A4NUc0MNJRY
Joriz Montes- Send My Love #scOUTevOUTe #brexit,https://www.youtube.com//watch?v=yr7doh68WSc
"Roman Invasion The Slaves, Episode,1,Season 10",https://www.youtube.com//watch?v=hDHnTPbJGgc
"Roman Invasion The Slaves, Episode,1,Season 9",https://www.youtube.com//watch?v=U8vQto2OF2w
"What is BRITISH LATIN? What does BRITISH LATIN mean? BRITISH LATIN meaning, definition & explanation",https://www.youtube.com//watch?v=3DBZqhTdwSI
"Roman Invasion The Slaves, Episode,1,Season 13",https://www.youtube.com//watch?v=LBy5JBZSEAQ
"Roman Invasion The Slaves, Episode,1,Season 11",https://www.youtube.com//watch?v=xAYp6GxrJPs
NEWS! Roman Entertainment youtube,https://www.youtube.com//watch?v=iDzRdRGHaL8
"Roman Invasion The Slaves, Episode,1,Season 8",https://www.youtube.com//watch?v=7WqpPiQY6og
Roman conquest of Anglesey,https://www.youtube.com//watch?v=zR374LgwGDg
Barbarians Rising: Boudica: Queen of the Celts | History,https://www.youtube.com//watch?v=F81D-vtsiqQ
Napoleon The Great (Part 1/4) Evolution to Empire,https://www.youtube.com//watch?v=IAZUGMNx2-U
How the World Map Looks Wildly Different Than You Think,https://www.youtube.com//watch?v=lPNrtjboISg
The Third Episode: The Roman Invasion,https://www.youtube.com//watch?v=HE3KQKyrGWg
Introduction,https://www.youtube.com//watch?v=h2WERRpVOxQ
Audiobook: Cymbeline by William Shakespeare | Full Version | Audio Books Classic 2,https://www.youtube.com//watch?v=5SmwVJcteG8
Melania Trump - direct mtDNA descendant of Holy Roman Empress Barbara of Cilli (1392–11 July 1451),https://www.youtube.com//watch?v=lch08JFdAH4
Britannia,https://www.youtube.com//watch?v=LKpI-d4iG8E
The Vindolanda - Roman Fort - Hadrians Wall - Drone,https://www.youtube.com//watch?v=BqPpLjwC2-c
"Still Report #723 - Brit Defense Chief Says ""Brexit""",https://www.youtube.com//watch?v=S6iHGPIcowg
John Morris (historian),https://www.youtube.com//watch?v=CLfdhI3f23Q
History of Scotland: The Forgotten History - Documentary History Channel,https://www.youtube.com//watch?v=RQ-IyLJEa5g
David Pawson -- Suffering (a),https://www.youtube.com//watch?v=3CcAJ2mdzkk
Top 10 Infamous Barrier Walls Throughout History — TopTenzNet,https://www.youtube.com//watch?v=zU7T3nLEw-0
10 Things You Didn't Know About China,https://www.youtube.com//watch?v=aPQSwfeC-80
George I of Great Britain,https://www.youtube.com//watch?v=8zySuL6X7H4
Napoleon History Channel Full Documentary,https://www.youtube.com//watch?v=-OgrkAvKf70
Audiobook: Germania by Publius Cornelius Tacitus | Audio Books Classic 2,https://www.youtube.com//watch?v=MtjZRrmq5Ns
THE LAST LEGION - HD [Sub español],https://www.youtube.com//watch?v=dUyHOkMCqSE
The History of the Romans: Every Year,https://www.youtube.com//watch?v=w5zYpWcz1-E
The ROMAN EMPIRE ✔ The Greatest Army of all Times | The WAR Machine,https://www.youtube.com//watch?v=tu8UfDlMBro
GREAT BRITAIN BLITZ CAMPAIGN - Empire Total War #1,https://www.youtube.com//watch?v=8obmQLdHwbU
Discoveries from the Roman Empire,https://www.youtube.com//watch?v=tR7GzB47OM8
THIS IS TOTAL WAR ATTILA - EASTERN ROMAN EMPIRE #1,https://www.youtube.com//watch?v=u75gCmmsiW0
Life After the Roman Empire,https://www.youtube.com//watch?v=B2H49pDEXCY
Mary Beard's Ultimate Rome: Empire Without Limit -Episode 2 BBC Documentary 2016,https://www.youtube.com//watch?v=QkugXWGmefw
MASSIVE HOLY ROMAN EMPIRE v AUSTRIA SURVIVAL! Medieval Kingdoms 1212AD Mod Gameplay,https://www.youtube.com//watch?v=-6ETIzy0Zx0
Incredible lecture on the fall of the Roman Empire,https://www.youtube.com//watch?v=s67-9uHAAwU
History of the Roman Empire: Trade and Economy in the Roman Empire.,https://www.youtube.com//watch?v=fi39laIeBiU
Evolution of the Roman Legions: Part 1 - Kingdom  (8-7th Century BC),https://www.youtube.com//watch?v=zrCqpJ05E3k
Aragon into Roman Empire - Eu4 Timelapse,https://www.youtube.com//watch?v=jv7K-oaQQhw
BBC - Mary Beard's Ultimate Rome: Empire Without Limit - Episode 1,https://www.youtube.com//watch?v=GYjnRAFFy4g
The Fall of the Roman Empire (1964) --- Senate scene,https://www.youtube.com//watch?v=ecMfU3910WY
History of the Roman Empire:Ancient Roman Infrastructure (Aqueducts and water management in Rome ),https://www.youtube.com//watch?v=AeKpRqjFSHM
The Parallels between Rome and the United States,https://www.youtube.com//watch?v=dCvyg679bsg
Taking the bus to Roman Britain,https://www.youtube.com//watch?v=JP53fc7ihSY
GREAT BRITAIN BLITZ CAMPAIGN - Empire Total War #2,https://www.youtube.com//watch?v=P7eE-8s1ViM
EU4 Timelapse - Rise of the Roman Empire (1444 - 1834),https://www.youtube.com//watch?v=m8NU6NqKB8U
THIS IS TOTAL WAR ATTILA - EASTERN ROMAN EMPIRE #57,https://www.youtube.com//watch?v=wfn7B3wlpek
Roman Invasion of Britain,https://www.youtube.com//watch?v=XsaXcDf35vE
THIS IS TOTAL WAR ATTILA - EASTERN ROMAN EMPIRE #51,https://www.youtube.com//watch?v=lh1MNaQAWKc
Ancient Indigenous History Great Black Biblical Rulers & the Holy Roman Empire,https://www.youtube.com//watch?v=FtmBHbZP4wQ
"TW Webcast:  Boris Johnson, the EU, and the Rising Roman Empire",https://www.youtube.com//watch?v=m1I4GUpcejI
"STELLARIS - Let's Play - Roman Empire - Ep.8 - ""Empire Strikes Back!""",https://www.youtube.com//watch?v=DmLyHFJIZak
Lost Roads of Ancient Rome Discovered with 3D Laser Scanners,https://www.youtube.com//watch?v=SBLNg3yGLFs
Total War Attila : Legendary West Rome : Part 1,https://www.youtube.com//watch?v=PfZYE-nk3Ow
Roman Empire Rules Today-Proof,https://www.youtube.com//watch?v=YfssIhyR8kQ
THIS IS TOTAL WAR ATTILA - EASTERN ROMAN EMPIRE #36,https://www.youtube.com//watch?v=suwZf5jYl_k
"STELLARIS - Let's Play - Roman Empire - Ep.5 - ""The Fox People!""",https://www.youtube.com//watch?v=Vb95EOWp9Jk
GREAT BRITAIN BLITZ CAMPAIGN - Empire Total War #40 FINAL,https://www.youtube.com//watch?v=lN_2gT788xY
The Roman Empire : The Reign Of Marcus Aurelius - History Movies,https://www.youtube.com//watch?v=ILAzk3b2Heg
THIS IS TOTAL WAR ATTILA - EASTERN ROMAN EMPIRE #55,https://www.youtube.com//watch?v=0Cx7VStBz7s
THE EMPEROR ASCENDS! Total War: Attila - Age of Charlemagne - Holy Roman Empire Campaign #63,https://www.youtube.com//watch?v=r5qaGbmeK2E
THIS IS TOTAL WAR ATTILA - EASTERN ROMAN EMPIRE #60,https://www.youtube.com//watch?v=GolkMZU8y8A
BBC Radio History for Schools 1984 - Roman Britain. Programme 2: The Invasion and the Army,https://www.youtube.com//watch?v=6Qm2yQjNe6I
EU4 Great Britain- Episode 33: The Empire Expands,https://www.youtube.com//watch?v=2EJIKjzq_QU
Roman Conquest of Britain 43 - 93 A.D (Every Year),https://www.youtube.com//watch?v=M4t4VUzZI6k
HADRIAN'S WALL | ENGLAND TRAVEL VLOG #1,https://www.youtube.com//watch?v=91mJobgB5KU
THIS IS TOTAL WAR ATTILA - EASTERN ROMAN EMPIRE #48,https://www.youtube.com//watch?v=7xo1mCnvpew
Units of Classical Antiquity: The Praetorian Guard (Roman Army),https://www.youtube.com//watch?v=VYSQsDyKC-c
THIS IS TOTAL WAR ATTILA - EASTERN ROMAN EMPIRE #56,https://www.youtube.com//watch?v=aSPZMZ3YdkE
The Birth of the Roman Empire - Decisive Battles of the Ancient World (9of13),https://www.youtube.com//watch?v=ImgYfQi13YQ
THIS IS TOTAL WAR ATTILA - EASTERN ROMAN EMPIRE #58,https://www.youtube.com//watch?v=ETkGDvhUvjs
40 Reasons Why  European Union is Revived Roman Empire of Bible Prophecy,https://www.youtube.com//watch?v=xWf0Al7TCcU
THIS IS TOTAL WAR ATTILA - EASTERN ROMAN EMPIRE #54,https://www.youtube.com//watch?v=6jgSMxFhLJo
Eternal Empire Introduction | Total War: Attila | Eastern Roman Empire Hard + Mods,https://www.youtube.com//watch?v=KZ8DyADwJqU
THE HOLY ROMAN EMPIRE! Total War: Attila - Age of Charlemagne - Kingdom of The Franks Campaign #36,https://www.youtube.com//watch?v=-9M_AVCTn3c
PEACE IN SPAIN! Total War: Attila - Age of Charlemagne - Holy Roman Empire Campaign #54,https://www.youtube.com//watch?v=hIBVTJoaXzk
GREAT BRITAIN BLITZ CAMPAIGN - Empire Total War #24,https://www.youtube.com//watch?v=PTcU11O0tTM
"""The Holy Roman Empire"" with Peter H. Wilson",https://www.youtube.com//watch?v=m3c8WHFPhrE
Savoy/Sardinia-Piedmont/Italy/Roman Empire Campaign | EUIV Timeline Showcase,https://www.youtube.com//watch?v=h4icTB9EhlI
THIS IS TOTAL WAR ATTILA - EASTERN ROMAN EMPIRE #50,https://www.youtube.com//watch?v=QVBVNmzaXGk
BBC Radio History for Schools 1984 - Roman Britain. Programme 5: The Twilight Years,https://www.youtube.com//watch?v=3wOt_erpEac
THIS IS TOTAL WAR ATTILA - EASTERN ROMAN EMPIRE #19,https://www.youtube.com//watch?v=7QiLv7How9c
The Holy Roman Empire in Prophecy - The Trumpet Daily,https://www.youtube.com//watch?v=7zGddWCymss
[Imperial Roman Army] Organization & Structure,https://www.youtube.com//watch?v=davyHtCSa_E
GREAT BRITAIN BLITZ CAMPAIGN - Empire Total War #26,https://www.youtube.com//watch?v=p5cfKFl5io0
GREAT BRITAIN BLITZ CAMPAIGN - Empire Total War #27,https://www.youtube.com//watch?v=XvzOqUvUH88
The Story of Roman Empire,https://www.youtube.com//watch?v=f2MrWZKumWI
UNITED IRELAND! Total War: Attila - Age of Charlemagne - Holy Roman Empire Campaign #57,https://www.youtube.com//watch?v=WYmpJn8szEY
CHARGE POWER! Total War: Attila - Age of Charlemagne - Holy Roman Empire Campaign #44,https://www.youtube.com//watch?v=ag2GQ6nbirM
EU4 Campaign - England to British Empire,https://www.youtube.com//watch?v=GdgOZPt5aO4
THIS IS TOTAL WAR ATTILA - EASTERN ROMAN EMPIRE #47,https://www.youtube.com//watch?v=2iK57RpvAF0
THIS IS TOTAL WAR ATTILA - EASTERN ROMAN EMPIRE #52,https://www.youtube.com//watch?v=cs_gVpMBILA
THIS IS TOTAL WAR ATTILA - EASTERN ROMAN EMPIRE #39,https://www.youtube.com//watch?v=JGxhetHleC4
The Holy Roman Empire! - Medieval Kingdoms 1212AD Total War - 007,https://www.youtube.com//watch?v=hRySSh87Sis
THIS IS TOTAL WAR ATTILA - EASTERN ROMAN EMPIRE #46,https://www.youtube.com//watch?v=tmVRnypj_4A
A BATTLE WITH BRITAIN! Empire Total War: Darthmod - Maratha Confederacy Campaign #66,https://www.youtube.com//watch?v=zooPRy-A4VE
Boris Johnson and the Revived Roman Empire,https://www.youtube.com//watch?v=PJe6i6TUAv4
Eternal Empire 1 | Total War: Attila | Eastern Roman Empire Hard + Mods,https://www.youtube.com//watch?v=-oGccaLcyDA
EUROPE REBORN! Total War: Attila - Age of Charlemagne - Holy Roman Empire Campaign #46,https://www.youtube.com//watch?v=AVWwLgi5PT4
Alternate History of the Holy Roman Empire,https://www.youtube.com//watch?v=W1wE8XXLc3I
GREAT BRITAIN BLITZ CAMPAIGN - Empire Total War #3,https://www.youtube.com//watch?v=H9sf-XHlVOY
THIS IS TOTAL WAR ATTILA - EASTERN ROMAN EMPIRE #11,https://www.youtube.com//watch?v=DOurIAOGWgE
GREAT BRITAIN BLITZ CAMPAIGN - Empire Total War #28,https://www.youtube.com//watch?v=VOdqxDKrr40
THIS IS TOTAL WAR ATTILA - EASTERN ROMAN EMPIRE #14,https://www.youtube.com//watch?v=mmUrcEpSHKc
THIS IS TOTAL WAR ATTILA - EASTERN ROMAN EMPIRE #31,https://www.youtube.com//watch?v=SM9geehbPy8
THE REVIVED ROMAN EMPIRE,https://www.youtube.com//watch?v=eq35m-CUnRI
SICILIAN SET-UP! Total War: Attila - Age of Charlemagne - Holy Roman Empire Campaign #48,https://www.youtube.com//watch?v=ThH91UuJ2OY
THIS IS TOTAL WAR ATTILA - EASTERN ROMAN EMPIRE #38,https://www.youtube.com//watch?v=q_6gus8KBB0
BBC Radio History for Schools 1984 - Roman Britain. Programme 1: The Romans are Here!,https://www.youtube.com//watch?v=cFHji46k14U
CLOCK PROPHECY 2016 - THE TRUMP-OBAMA-NATO CONNECTION - REVIVING THE ROMAN EMPIRE,https://www.youtube.com//watch?v=yvTFYgrwsEU
THIS IS TOTAL WAR ATTILA - EASTERN ROMAN EMPIRE #29,https://www.youtube.com//watch?v=_Jbh3n90UEQ
GREAT BRITAIN BLITZ CAMPAIGN - Empire Total War #29,https://www.youtube.com//watch?v=5thdyRa1PKU
SPANISH HOLIDAY! Total War: Attila - Age of Charlemagne - Holy Roman Empire Campaign #52,https://www.youtube.com//watch?v=4Lch3QZeNJc
GREAT BRITAIN BLITZ CAMPAIGN - Empire Total War #21,https://www.youtube.com//watch?v=6iV7JOtHUac
America is still a British Colony Under The Roman Empire,https://www.youtube.com//watch?v=8iQ9FCFy034
GREAT BRITAIN BLITZ CAMPAIGN - Empire Total War #16,https://www.youtube.com//watch?v=u21SSi-9lh8
THE EMPERORS REST! Total War: Attila - Age of Charlemagne - Holy Roman Empire Campaign #55,https://www.youtube.com//watch?v=YlOqkaohxtI
The Roman Empire Documentary - Fall Of The West,https://www.youtube.com//watch?v=mWyPP6n1y0g
Total War Attila - Western Roman Empire Campaign - Part 1,https://www.youtube.com//watch?v=hFFK0afk-C8
Total War: ATTILA Online Battle #002 - Saxons vs. Eastern Roman Empire,https://www.youtube.com//watch?v=IZsVx_fVc7Q
SICILY'S END! Total War: Attila - Age of Charlemagne - Holy Roman Empire Campaign #50,https://www.youtube.com//watch?v=h6-6l2sXekk
GREAT BRITAIN BLITZ CAMPAIGN - Empire Total War #36,https://www.youtube.com//watch?v=6aPz7cSTe4s
Eternal Empire 25 | Total War: Attila | Eastern Roman Empire Hard + Mods,https://www.youtube.com//watch?v=qeVlQGJ0aoc
SPANISH BETRAYAL! Total War: Attila - Age of Charlemagne - Holy Roman Empire Campaign #51,https://www.youtube.com//watch?v=6vTIuC7YLsU
GREAT BRITAIN BLITZ CAMPAIGN - Empire Total War #23,https://www.youtube.com//watch?v=200pTBKdUiU
GREAT BRITAIN BLITZ CAMPAIGN - Empire Total War #25,https://www.youtube.com//watch?v=x54uKicSkKY
The Roman Empire - mysimpleshow,https://www.youtube.com//watch?v=OmsyvLok3xI
Learn Military History - #3 - The Roman Legions - 300 BCE - 476 CE,https://www.youtube.com//watch?v=O09EfT2BQhc
European Union Is The Revived Roman Empire (Exclusive)!!!!!!!,https://www.youtube.com//watch?v=U4j5yE2ophc
BAVARIAN BUST UP! Total War: Attila - Age of Charlemagne - Holy Roman Empire Campaign #42,https://www.youtube.com//watch?v=2byZe5UmZSo
"[History Audiobook] The Decline and Fall of the Roman Empire, Volume 2, Part 1",https://www.youtube.com//watch?v=JfhfFV7Lcfs
Eternal Empire 2 | Total War: Attila | Eastern Roman Empire Hard + Mods,https://www.youtube.com//watch?v=3vF5KEPxfCw
SO IT BEGINS! Total War: Attila - Age of Charlemagne - Holy Roman Empire Campaign #49,https://www.youtube.com//watch?v=YjOUxrLXSI4
Eternal Empire 83 | Total War: Attila | Eastern Roman Empire Hard + Mods,https://www.youtube.com//watch?v=tj3WHVAf4IA
THIS IS TOTAL WAR ATTILA - EASTERN ROMAN EMPIRE #35,https://www.youtube.com//watch?v=MoLnN21hWX8
GREAT BRITAIN BLITZ CAMPAIGN - Empire Total War #7,https://www.youtube.com//watch?v=4k-F-b3751s
Portus ~ A Key To The Roman Empire,https://www.youtube.com//watch?v=FAQksD9wcpc
THIS IS TOTAL WAR ATTILA - EASTERN ROMAN EMPIRE #4,https://www.youtube.com//watch?v=J3DQFnFsjOw
Barbarian | The Destroyer Of The Roman Empire History Documentary,https://www.youtube.com//watch?v=qr3UBbbV6cw
"[History Audiobook] The Decline and Fall of the Roman Empire, Volume 2, Part 2",https://www.youtube.com//watch?v=5v9jLD2vpyY
Lets Play - Empire Total War (DM)  - Great Britain  - .....An Old Enemy Strikes Back!!... (41),https://www.youtube.com//watch?v=6cctreabEXo
The Defeat of the Holy Roman Empire & the Triumph of Napoleon  Revelation 16  Vials 1 5,https://www.youtube.com//watch?v=ywQv0ScjDwo
THIS IS TOTAL WAR ATTILA - EASTERN ROMAN EMPIRE #23,https://www.youtube.com//watch?v=pHKiRzwE-rQ
Caracalla Roman Empire Denarius Seven Hills Hoard,https://www.youtube.com//watch?v=SNGJV5zvg3s
How did Rome become so powerful and important and why do we care?,https://www.youtube.com//watch?v=ZWzTgljmdrk
Total War Attila :: Eastern Roman Empire (VH) : Part 19 Unwelcome Guests,https://www.youtube.com//watch?v=fvfEzQmAoKQ
GREAT BRITAIN BLITZ CAMPAIGN - Empire Total War #32,https://www.youtube.com//watch?v=txz6-8cA1Rk
THIS IS TOTAL WAR ATTILA - EASTERN ROMAN EMPIRE #43,https://www.youtube.com//watch?v=oowUVeob9zY
GREAT BRITAIN BLITZ CAMPAIGN - Empire Total War #12,https://www.youtube.com//watch?v=LyQVtXC-am8
GREAT BRITAIN BLITZ CAMPAIGN - Empire Total War #14,https://www.youtube.com//watch?v=DuZqZIve7qI
THIS IS TOTAL WAR ATTILA - EASTERN ROMAN EMPIRE #44,https://www.youtube.com//watch?v=vJnyPFj626Y
Eternal Empire 28 | Total War: Attila | Eastern Roman Empire Hard + Mods,https://www.youtube.com//watch?v=aBPLPMe7QbQ
Eternal Empire 87 | Total War: Attila | Eastern Roman Empire Hard + Mods,https://www.youtube.com//watch?v=V0j2jim2aLM
The Gothic War Continues   Gibbons Decline and Fall of the Roman Empire Chapter 41 Part 4,https://www.youtube.com//watch?v=-3QdKIow-fc
GREAT BRITAIN BLITZ CAMPAIGN - Empire Total War #31,https://www.youtube.com//watch?v=-WpnhwyK7Mo
If the Eastern Roman Empire defeated the Vandals in 468? - [Your Weekly Alternate History | 4 ],https://www.youtube.com//watch?v=pD5lyRi_0Gs
Eternal Empire 77 | Total War: Attila | Eastern Roman Empire Hard + Mods,https://www.youtube.com//watch?v=lFNeKynTju4
GREAT BRITAIN BLITZ CAMPAIGN - Empire Total War #11,https://www.youtube.com//watch?v=oQF1R0aFDNM
THIS IS TOTAL WAR ATTILA - EASTERN ROMAN EMPIRE #37,https://www.youtube.com//watch?v=V7ibuzSxMFY
ASTURIAS' END! Total War: Attila - Age of Charlemagne - Holy Roman Empire Campaign #53,https://www.youtube.com//watch?v=WPvHXQCcTGc
The Roman Empire Episode 4: Grasp Of An Empire (History Documentary),https://www.youtube.com//watch?v=MovEFm06np8
Roman History 15 - Galba To Agricola 69 - 79 AD,https://www.youtube.com//watch?v=R32oYQJOatw
Lets Play - Empire Total War (DM)  - Great Britain  - .....British Elite!!... (39),https://www.youtube.com//watch?v=-9CmELSqSPI
Eternal Empire 5 | Total War: Attila | Eastern Roman Empire Hard + Mods,https://www.youtube.com//watch?v=yzK8IJd4Vmk
GREAT BRITAIN BLITZ CAMPAIGN - Empire Total War #8,https://www.youtube.com//watch?v=dOka8zKlByg
